{
  "version": 1,
  "id": "work-agent-default",
  "name": "Work Agent Default",
  "description": "A conservative starting profile: learn in observe mode first, then tighten rules after repeated evidence.",
  "defaults": {
    "mode": "observe",
    "new_rule_stage": "recommend"
  },
  "review_preferences": {
    "human_signoff_required_for_stage_promotion": true,
    "reviewer_confidence_scale": ["low", "medium", "high"],
    "major_rewrite_definition": "A change counts as a major rewrite when a reviewer replaces the main structure or requirement flow rather than making local edits."
  },
  "promotion_preferences": {
    "evidence_checks_required_before_require": ["npm run ci:fast"],
    "warnings_block_in_ci": false,
    "require_consistent_feedback_before_promotion": true
  }
}
